{
  "$schema": "https://json-schema.org/draft/2020-12/schema",
  "$id": "https://sextant.dev/schemas/cost_ledger.v1.schema.json",
  "title": "CostLedgerV1",
  "description": "Every token, dollar, and millisecond an agent run spent, itemized per step and totalled. Persisted alongside the trace and aggregated per eval run; cost per correct answer is derived from these. Accounting is built in from the first commit because retrofitting it is how you end up without it.",
  "type": "object",
  "additionalProperties": false,
  "required": ["schema", "run_id", "entries", "totals", "price_table_date"],
  "properties": {
    "schema": {
      "description": "Contract discriminator, always cost_ledger.v1",
      "type": "string",
      "const": "cost_ledger.v1"
    },
    "run_id": {
      "description": "Identifier of the agent run this ledger belongs to",
      "type": "string",
      "minLength": 1,
      "maxLength": 64
    },
    "price_table_date": {
      "description": "The date the price table used for these dollar figures was last verified, as ISO 8601. Prices live in versioned config, never inline, so a stale table is visible rather than silent.",
      "type": "string",
      "format": "date"
    },
    "entries": {
      "description": "One entry per step that consumed tokens or time",
      "type": "array",
      "items": { "$ref": "#/$defs/entry" },
      "maxItems": 256
    },
    "totals": { "$ref": "#/$defs/totals" }
  },
  "$defs": {
    "entry": {
      "type": "object",
      "additionalProperties": false,
      "required": ["step", "model", "tokens_in", "tokens_out", "usd", "ms"],
      "properties": {
        "step": {
          "description": "Index of the trace event this charge belongs to",
          "type": "integer",
          "minimum": 0
        },
        "model": {
          "description": "Model id charged, e.g. claude-haiku-4-5-20251001",
          "type": "string",
          "minLength": 1,
          "maxLength": 128
        },
        "tokens_in": {
          "description": "Input tokens as reported by the provider, not estimated",
          "type": "integer",
          "minimum": 0
        },
        "tokens_out": {
          "description": "Output tokens as reported by the provider",
          "type": "integer",
          "minimum": 0
        },
        "cache_read_tokens": {
          "description": "Input tokens served from the provider's prompt cache, billed at roughly a tenth of the standard input rate. Reported separately from tokens_in because a single combined figure makes the dollar amount uncheckable: three classes of input token bill at three different rates, and no reader could recover which was which.",
          "type": "integer",
          "minimum": 0,
          "default": 0
        },
        "cache_write_tokens": {
          "description": "Input tokens written into the provider's prompt cache, billed at a premium over the standard input rate. A cache write is an investment that only pays off if a later request reads it, so it is worth being able to see one that never did.",
          "type": "integer",
          "minimum": 0,
          "default": 0
        },
        "usd": {
          "description": "Dollars for this step, computed from the versioned price table",
          "type": "number",
          "minimum": 0
        },
        "ms": {
          "description": "Wall-clock milliseconds this step took",
          "type": "integer",
          "minimum": 0
        },
        "cost_known": {
          "description": "False when the provider closed the stream without reporting usage. The runtime never estimates token counts, so such a step has an unknown cost, not a zero one — tokens_in, tokens_out and usd are then all 0 and carry no meaning. A reader that ignores this flag will report a paid step as free.",
          "type": "boolean",
          "default": true
        },
        "cache_hit": {
          "description": "True when the semantic cache served this step and no provider call was made",
          "type": "boolean",
          "default": false
        },
        "escalated": {
          "description": "True when this step ran on the expensive tier because the router escalated",
          "type": "boolean",
          "default": false
        },
        "repair_depth": {
          "description": "Repair iteration this step belongs to; 0 is the first attempt",
          "type": "integer",
          "minimum": 0,
          "default": 0
        }
      }
    },
    "totals": {
      "type": "object",
      "additionalProperties": false,
      "required": ["tokens_in", "tokens_out", "usd", "ms"],
      "properties": {
        "tokens_in": { "type": "integer", "minimum": 0 },
        "tokens_out": { "type": "integer", "minimum": 0 },
        "cache_read_tokens": {
          "description": "Total input tokens served from the prompt cache across the run. The dollars-saved figure PLAN.md section 5.6 asks for is derived from this.",
          "type": "integer",
          "minimum": 0,
          "default": 0
        },
        "cache_write_tokens": {
          "description": "Total input tokens written into the prompt cache across the run",
          "type": "integer",
          "minimum": 0,
          "default": 0
        },
        "usd": {
          "description": "Sum of entry dollars. The per-question budget cap is enforced against this value as it grows, not after the fact.",
          "type": "number",
          "minimum": 0
        },
        "ms": { "type": "integer", "minimum": 0 },
        "provider_calls": {
          "description": "Number of steps that actually hit a provider, i.e. entries with cache_hit false",
          "type": "integer",
          "minimum": 0,
          "default": 0
        },
        "cache_hits": { "type": "integer", "minimum": 0, "default": 0 },
        "steps_cost_unknown": {
          "description": "How many entries have cost_known false. When this is above zero the totals above are a LOWER BOUND, not the cost of the run, and anything deriving cost per correct answer has to say so.",
          "type": "integer",
          "minimum": 0,
          "default": 0
        }
      }
    }
  }
}
